{
  "slug": "sendy",
  "name": "Sendy",
  "tagline": "Logistics and delivery API for Africa.",
  "description": "Sendy provides an API for businesses to streamline their logistics and delivery operations across East Africa, connecting to a network of transporters.",
  "website": "https://sendy.co.ke",
  "documentation": "https://docs.sendy.co.ke",
  "developerPortal": "https://sendy.co.ke",
  "supportEmail": "support@sendy.co.ke",
  "headquarters": "Kenya",
  "categories": ["Logistics"],
  "countries": ["Kenya", "Uganda", "Tanzania"],
  "features": ["Package tracking", "Delivery scheduling", "Real-time pricing", "Multiple transporters"],
  "pricingModel": "transaction",
  "authentication": "API Key",
  "apiStyle": "REST",
  "sdkLanguages": ["JavaScript", "Python", "PHP"],
  "sandboxAvailable": true,
  "productionReady": true,
  "status": "Live",
  "verified": true,
  "lastVerified": "2026-07-16",
  "lastUpdated": "2026-07-16",
  "keyPeople": [
    { "name": "Levi Leigh", "role": "Co-founder" }
  ]
}