{
  "slug": "nalo-sms",
  "name": "Nalo Solutions",
  "tagline": "Bulk SMS and messaging API with delivery reports across West Africa.",
  "description": "Bulk SMS and messaging API with delivery reports across West Africa. Send SMS via API to Ghanaian and Nigerian phone numbers.",
  "website": "https://nalosolutions.com",
  "documentation": "https://nalosolutions.com/sms-api",
  "developerPortal": "https://nalosolutions.com/sms-api",
  "supportEmail": "support@nalosolutions.com",
  "headquarters": "Ghana",
  "categories": ["SMS"],
  "countries": ["Ghana", "Nigeria"],
  "features": ["Bulk SMS", "Delivery reports", "Messaging", "Two-way SMS"],
  "pricingModel": "pay-per-use",
  "authentication": "Bearer Token",
  "apiStyle": "REST",
  "sandboxAvailable": true,
  "productionReady": true,
  "sdkLanguages": ["JavaScript", "Python", "Go", "PHP"],
  "status": "Live",
  "verified": true,
  "lastVerified": "2026-07-10",
  "lastUpdated": "2026-07-10"
}